{
  "$id": "opencerts/v1.2",
  "$schema": "http://json-schema.org/draft-07/schema#",
  "type": "object",
  "properties": {
    "$schema": {
      "type": "string"
    },
    "id": {
      "type": "string"
    },
    "$template": {
      "type": "string"
    },
    "issuedOn": {
      "type": "string",
      "format": "date-time",
      "examples": ["2018-08-01T00:00:00+08:00"]
    },
    "expiredOn": {
      "type": "string",
      "format": "date-time"
    },
    "admissionDate": {
      "type": "string",
      "format": "date-time"
    },
    "graduationDate": {
      "type": "string",
      "format": "date-time"
    },
    "cumulativeScore": {
      "type": "number"
    },
    "name": {
      "type": "string"
    },
    "issuers": {
      "type": "array",
      "items": {
        "type": "object",
        "properties": {
          "name": {
            "type": "string"
          },
          "did": {
            "type": "string"
          },
          "url": {
            "type": "string",
            "format": "url"
          },
          "email": {
            "type": "string",
            "format": "email"
          },
          "phone": {
            "type": "string"
          },
          "certificateStore": {
            "type": "string"
          }
        },
        "required": ["name", "certificateStore"],
        "additionalProperties": false
      },
      "exampples": [
        {
          "name": "Blockchain Academy",
          "did": "DID:SG-UEN:U18274928E",
          "url": "https://blockchainacademy.com",
          "email": "registrar@blockchainacademy.com",
          "certificateStore": "0xd9580260be45c3c0c2fb259a82f219b513054012"
        }
      ]
    },
    "recipient": {
      "type": "object",
      "properties": {
        "name": {
          "type": "string"
        },
        "did": {
          "type": "string"
        },
        "url": {
          "type": "string"
        },
        "email": {
          "type": "string"
        },
        "phone": {
          "type": "string"
        }
      },
      "required": ["name"],
      "additionalProperties": false
    },
    "transcript": {
      "type": "array",
      "items": {
        "type": "object",
        "properties": {
          "name": {
            "type": "string"
          },
          "score": {
            "type": ["number", "string"]
          },
          "grade": {
            "type": ["number", "string"]
          },
          "courseCredit": {
            "type": ["number", "string"]
          },
          "courseCode": {
            "type": "string"
          },
          "examinationDate": {
            "type": "string",
            "format": "date-time"
          },
          "url": {
            "type": "string"
          },
          "description": {
            "type": "string"
          }
        },
        "required": ["name"],
        "additionalProperties": false
      }
    },
    "additionalData": {
      "type": "object"
    }
  },
  "required": ["$schema", "id", "name", "issuedOn", "issuers", "recipient"],
  "additionalProperties": false
}
